link	title	abstract	references	journal	doi
https://journals.plos.org/plosone/article?id=10.1371/journal.pone.0267213	Validation pipeline for machine learning algorithm assessment for multiple vendors	A standardized objective evaluation method is needed to compare machine learning (ML) algorithms as these tools become available for clinical use. Therefore, we designed, built, and tested an evaluation pipeline with the goal of normalizing performance measurement of independently developed algorithms, using a common test dataset of our clinical imaging. Three vendor applications for detecting solid, part-solid, and groundglass lung nodules in chest CT examinations were assessed in this retrospective study using our data-preprocessing and algorithm assessment chain. The pipeline included tools for image cohort creation and de-identification; report and image annotation for ground-truth labeling; server partitioning to receive vendor “black box” algorithms and to enable model testing on our internal clinical data (100 chest CTs with 243 nodules) from within our security firewall; model validation and result visualization; and performance assessment calculating algorithm recall, precision, and receiver operating characteristic curves (ROC). Algorithm true positives, false positives, false negatives, recall, and precision for detecting lung nodules were as follows: Vendor-1 (194, 23, 49, 0.80, 0.89); Vendor-2 (182, 270, 61, 0.75, 0.40); Vendor-3 (75, 120, 168, 0.32, 0.39). The AUCs for detection of solid (0.61–0.74), groundglass (0.66–0.86) and part-solid (0.52–0.86) nodules varied between the three vendors. Our ML model validation pipeline enabled testing of multi-vendor algorithms within the institutional firewall. Wide variations in algorithm performance for detection as well as classification of lung nodules justifies the premise for a standardized objective ML algorithm evaluation process.	['https://doi.org/10.1109/TMI.2014.2377694', 'https://doi.org/10.1016/j.media.2017.06.015', 'https://doi.org/10.1093/jnci/djn384', 'https://doi.org/10.1016/j.acra.2008.05.022', 'https://doi.org/10.1016/j.jacr.2017.04.031', 'https://doi.org/10.1007/s00330-021-08365-z', 'https://doi.org/10.1016/j.cmpb.2021.106239', 'https://doi.org/10.1007/s12350-019-01906-6', 'https://doi.org/10.1016/j.acra.2021.09.002', 'https://doi.org/10.1038/s41591-021-01312-x', 'https://doi.org/https%3A//doi.org/10.1038/s42256-021-00307-0', 'https://doi.org/10.1148/radiographics.21.2.g01mr17403']	PLOS	https://doi.org/10.1371/journal.pone.0267213
https://journals.plos.org/plosone/article?id=10.1371/journal.pone.0267211	Identifying luminal and basal mammary cell specific genes and their expression patterns during pregnancy	Mammary gland is present in all mammals and usually functions in producing milk to feed the young offspring. Mammogenesis refers to the growth and development of mammary gland, which begins at puberty and ends after lactation. Pregnancy is regulated by various cytokines, which further contributes to mammary gland development. Epithelial cells, including basal and luminal cells, are one of the major components of mammary gland cells. The development of basal and luminal cells has been observed to significantly differ at different stages. However, the underlying mechanisms for differences between basal and luminal cells have not been fully studied. To explore the mechanisms underlying the differentiation of mammary progenitors or their offspring into luminal and myoepithelial cells, the single-cell sequencing data on mammary epithelia cells of virgin and pregnant mouse was deeply investigated in this work. We evaluated features by using Monte Carlo feature selection and plotted the incremental feature selection curve with support vector machine or RIPPER to find the optimal gene features and rules that can divide epithelial cells into four clusters with different cell subtypes like basal and luminal cells and different phases like pregnancy and virginity. As representations, the feature genes Cldn7, Gjb6, Sparc, Cldn3, Cited1, Krt17, Spp1, Cldn4, Gjb2 and Cldn19 might play an important role in classifying the epithelial mammary cells. Notably, seven most important rules based on the combination of cell-specific and tissue-specific expressions of feature genes effectively classify the epithelial mammary cells in a quantitative and interpretable manner.	['https://doi.org/10.1002/wdev.35', 'https://doi.org/10.1186/s13058-017-0921-7', 'https://doi.org/10.1242/dev.087643', 'https://doi.org/10.1038/ncb1530', 'https://doi.org/10.1186/bcr3334', 'https://doi.org/10.1387/ijdb.113385mm', 'https://doi.org/10.1093/bioinformatics/btm486', 'https://doi.org/10.1074/jbc.RA118.002297', 'https://doi.org/10.1093/bioinformatics/btz757', 'https://doi.org/10.1093/bioinformatics/btaa166', 'https://doi.org/10.3389/fgene.2020.599970', 'https://doi.org/10.3389/fcell.2020.627302', 'https://doi.org/10.3389/fgene.2020.626500', 'https://doi.org/10.1016/0005-2795(75)90109-9', 'https://doi.org/10.1016/j.compbiolchem.2004.09.006', 'https://doi.org/10.1016/j.mbs.2018.09.010', 'https://doi.org/10.1016/j.bbapap.2021.140621', 'https://doi.org/10.1073/pnas.1303053111', 'https://doi.org/10.1371/journal.pone.0112987', 'https://doi.org/10.1186/bcr988', 'https://doi.org/10.1016/j.jcpa.2008.08.001', 'https://doi.org/10.1016/j.ydbio.2016.06.011', 'https://doi.org/10.1007/s00441-004-0915-5', 'https://doi.org/10.1016/j.ydbio.2014.11.026', 'https://doi.org/10.1158/0008-5472.can-03-2028', 'https://doi.org/10.1186/bcr983', 'https://doi.org/10.1016/j.fertnstert.2013.07.001', 'https://doi.org/10.1038/sj.onc.1210468', 'https://doi.org/10.1038/sj.onc.1209183', 'https://doi.org/10.1038/s41388-018-0562-z', 'https://doi.org/10.1007/s10549-012-2164-8', 'https://doi.org/10.1038/nature04659', 'https://doi.org/10.1177/1947601913496813', 'https://doi.org/10.1002/mrd.20794', 'https://doi.org/10.1016/j.febslet.2011.01.028', 'https://doi.org/10.1097/PAI.0b013e31828d9d62', 'https://doi.org/10.1186/1471-2407-13-268', 'https://doi.org/10.1038/gt.2011.136', 'https://doi.org/10.1007/s12253-011-9481-9', 'https://doi.org/10.1002/eji.200939605', 'https://doi.org/10.1016/s0092-8674(01)00638-9', 'https://doi.org/10.3109/14767058.2010.538454', 'https://doi.org/10.1016/j.bbrc.2018.08.187']	PLOS	https://doi.org/10.1371/journal.pone.0267211
https://journals.plos.org/plosone/article?id=10.1371/journal.pone.0267146	Using machine learning for the personalised prediction of revision endoscopic sinus surgery	Revision endoscopic sinus surgery (ESS) is often considered for chronic rhinosinusitis (CRS) if maximal conservative treatment and baseline ESS prove insufficient. Emerging research outlines the risk factors of revision ESS. However, accurately predicting revision ESS at the individual level remains uncertain. This study aims to examine the prediction accuracy of revision ESS and to identify the effects of risk factors at the individual level.	['https://doi.org/10.4193/Rhin20.600', 'https://doi.org/10.1111/all.13411', 'https://doi.org/10.4193/Rhin17.240', 'https://doi.org/10.1111/all.13599', 'https://doi.org/10.1002/iid3.347', 'https://doi.org/10.1186/s12890-021-01578-4', 'https://doi.org/10.1002/lary.24916', 'https://doi.org/10.1177/0194599814543778', 'https://doi.org/10.1111/j.1749-4486.2006.01275.x', 'https://doi.org/10.1016/j.anai.2019.01.018', 'https://doi.org/10.4193/Rhin20.103', 'https://doi.org/10.3390/ijms21249477', 'https://doi.org/10.1002/lio2.27', 'https://doi.org/10.4193/Rhino15.284', 'https://doi.org/10.1002/lary.26741', 'https://doi.org/10.1002/alr.22264', 'https://doi.org/10.1002/lary.26248', 'https://doi.org/10.1002/alr.22505', 'https://doi.org/10.1002/alr.22487', 'https://doi.org/10.2500/ajra.2017.31.4402', 'https://doi.org/10.1002/alr.22407', 'https://doi.org/10.1002/alr.21739', 'https://doi.org/10.1016/j.jclinepi.2019.02.004', 'https://doi.org/10.1038/s42256-019-0138-9', 'https://doi.org/10.1214/aos/1013203450', 'https://doi.org/10.1080/10618600.2012.679223', 'https://doi.org/10.1186/s12911-015-0203-1', 'https://doi.org/10.1186/1472-6947-14-75', 'https://doi.org/10.1186/1471-2458-13-105', 'https://doi.org/10.1007/s00134-003-1761-8', 'https://doi.org/10.1109/MCSE.2011.37', 'https://doi.org/10.1080/17538157.2016.1255632', 'https://doi.org/10.1177/000348941112000304', 'https://doi.org/10.1021/acs.analchem.0c04497', 'https://doi.org/10.1371/journal.pone.0222397', 'https://doi.org/10.1016/j.jaci.2019.12.897', 'https://doi.org/10.1371/journal.pone.0247784', 'https://doi.org/10.1016/j.jaci.2017.11.027', 'https://doi.org/10.1002/alr.22632', 'https://doi.org/10.1002/alr.22196', 'https://doi.org/10.1371/journal.pone.0215133', 'https://doi.org/10.1093/aje/kwy121', 'https://doi.org/10.1016/j.spinee.2019.06.002', 'https://doi.org/10.1097/BRS.0000000000002515', 'https://doi.org/10.1371/journal.pone.0226272', 'https://doi.org/10.2500/ajra.2010.24.3476', 'https://doi.org/10.1016/j.ijmedinf.2016.03.005', 'https://doi.org/10.1177/21526567211003844', 'https://doi.org/10.1177/2152656720956596', 'https://doi.org/10.4193/Rhin19.184', 'https://doi.org/10.1111/all.12983', 'https://doi.org/10.1016/j.jaip.2020.06.063', 'https://doi.org/10.1016/j.iac.2016.06.008', 'https://doi.org/10.1002/alr.21885', 'https://doi.org/10.2500/ajra.2015.29.4231', 'https://doi.org/10.1016/j.amjoto.2016.02.002', 'https://doi.org/10.1007/s00405-015-3598-5', 'https://doi.org/10.1002/lary.27267', 'https://doi.org/10.2500/ajra.2014.28.4024', 'https://doi.org/10.4193/Rhino10.261', 'https://doi.org/10.1002/lary.24154', 'https://doi.org/10.1002/alr.22146', 'https://doi.org/10.1038/s41598-020-62971-3', 'https://doi.org/10.1186/s12911-017-0442-4', 'https://doi.org/10.1016/j.mri.2019.08.011', 'https://doi.org/10.1371/journal.pone.0232414', 'https://doi.org/10.1053/j.jvca.2020.10.023', 'https://doi.org/10.3109/02770903.2011.611956', 'https://doi.org/10.1136/bmjopen-2018-022173']	PLOS	https://doi.org/10.1371/journal.pone.0267146
https://journals.plos.org/plosone/article?id=10.1371/journal.pone.0266425	Underwater acoustic target recognition method based on a joint neural network	To improve the recognition accuracy of underwater acoustic targets by artificial neural network, this study presents a new recognition method that integrates a one-dimensional convolutional neural network and a long short-term memory network. This new network framework is constructed and applied to underwater acoustic target recognition for the first time. Ship acoustic data are used as input to evaluate the network performance. A visual analysis of the recognition results is performed. The results show that this method can realize the recognition and classification of underwater acoustic targets. Compared with a single neural network, the relevant indices, such as the recognition accuracy of the joint network are considerably higher. This provides a new direction for the application of deep learning in the field of underwater acoustic target recognition.	['https://doi.org/10.3390/e20040243', 'https://doi.org/10.1155/2018/1214301', 'https://doi.org/10.3390/s21041429', 'https://doi.org/10.3390/rs11161928', 'https://doi.org/10.1155/2020/8848507', 'https://doi.org/10.1155/2016/8154809', 'https://doi.org/10.1038/s41598-021-88799-z', 'https://doi.org/10.1097/AUD.0000000000000936']	PLOS	https://doi.org/10.1371/journal.pone.0266425
https://journals.plos.org/plosone/article?id=10.1371/journal.pone.0267852	Thermo-mechanics aspects of isochoric cryopreservation: A new modeling approach and comparison with experimental data	A new mathematical model is proposed for the analysis of thermo-mechanics effects during isochoric cryopreservation. In that process, some ice crystallization in a fixed-volume container drives pressure elevation, which may be favorable to the preservation of biological material when it resides in the unfrozen portion of the same container. The proposed model is comprehensive, integrating for the first time concepts from the disparate fields of thermodynamics, heat transfer, fluid mechanics, and solid mechanics. The novelty in this study is in treating the cryopreserved material as having a pseudo-viscoelastic behavior over a very narrow temperature range, without affecting the mechanical behavior of the material in the rest of the domain. This unique approach permits treating the domain as a continuum, while avoiding the need to trace freezing fronts and sperate the analysis to liquid and solid subdomains. Consistent with the continuum approach, the heat transfer problem is solved using the enthalpy approach. The presented analysis focusses on isochoric cooling of pure water between standard atmospheric conditions and the triple point of liquid water, ice Ih, and ice III (-22°C and 207.4 MPa). The proposed model is also applicable to isochoric vitrification, by substituting the pseudo-viscoelastic material model with the real viscosity model of the vitrifying material. Results of this study display good agreement with phase-diagram data at steady state, and with experimental data from the literature. Furthermore, this study provides a venue to discussing experimentation aspects of isochoric cryopreservation. The proposed model is further demonstrated on a 3D problem, while discussing scale considerations, crystallization conditions, and transient effects. Notably, the new model can be used to bridge the gap between limited pressure and temperature measurements during cryopreservation and the analysis of the continuum. Arguably, this study presents the most advanced thermo-mechanics model to solve practical problems relating to isochoric cryopreservation.	['https://doi.org/10.1016/j.cryobiol.2019.01.003', 'https://doi.org/10.1159/000499453', 'https://doi.org/10.1016/j.cryobiol.2004.12.002', 'https://doi.org/10.1016/J.IFSET.2018.10.016', 'https://doi.org/10.1111/IJFS.14463', 'https://doi.org/10.1126/science.168.3934.939', 'https://doi.org/10.2307/20022754', 'https://doi.org/10.1371/journal.pone.0183353', 'https://doi.org/10.1016/j.cryobiol.2018.04.004', 'https://doi.org/10.1016/j.bbrc.2018.01.140', 'https://doi.org/10.1038/s42003-021-02650-9', 'https://doi.org/10.1016/j.bbrc.2017.02.091', 'https://doi.org/10.1016/0017-9310(93)80043-T', 'https://doi.org/10.1016/j.cryobiol.2006.03.013', 'https://doi.org/10.1016/j.cryogenics.2014.09.005', 'https://doi.org/10.1016/j.cryobiol.2021.01.002', 'https://doi.org/10.1371/journal.pone.0199155', 'https://doi.org/10.1007/s11340-008-9191-8', 'https://doi.org/10.1016/j.cryobiol.2017.02.001', 'https://doi.org/10.1115/1.4047420', 'https://doi.org/10.1063/1.442402', 'https://doi.org/10.1007/s11837-999-0206-4', 'https://doi.org/10.1023/A:1004385611382', 'https://doi.org/10.1063/1.329644', 'https://doi.org/10.1080/00018735800101237', 'https://doi.org/10.1016/j.cryobiol.2016.06.004', 'https://doi.org/10.1016/S0017-9310(02)00056-X', 'https://doi.org/10.1016/J.ICHEATMASSTRANSFER.2016.08.026']	PLOS	https://doi.org/10.1371/journal.pone.0267852
